{
  "descriptor": {
    "sessionId": "22222222-2222-4222-8222-222222222222",
    "tenantId": "11111111-1111-4111-8111-111111111111",
    "experienceId": "11111111-1111-4111-8111-111111111111",
    "experienceVersion": 2,
    "state": "starting",
    "createdAt": "2026-10-04T12:00:00.000Z",
    "expiresAt": "2026-10-04T12:00:00.000Z",
    "endedAt": null,
    "environmentImage": "registry.example/lazarus/git@sha256:aaaaaaaaaaaaaaaaaaaaaaaaaaaaaaaaaaaaaaaaaaaaaaaaaaaaaaaaaaaaaaaa",
    "failureCode": null
  },
  "limits": {
    "maxDurationSeconds": 1800,
    "maxExecutions": 100,
    "maxConcurrent": 2,
    "remainingExecutions": null
  },
  "ticket": {
    "ticket": "tttttttttttttttttttttttttttttttttttttttttttttttt",
    "sessionId": "22222222-2222-4222-8222-222222222222",
    "expiresAt": "2026-10-04T12:00:00.000Z"
  },
  "hubUrl": "/hubs/execution"
}
